{
  "schema_version": "1.0",
  "company_slug": "example",
  "company_id": "12345",
  "period": "2024-01",
  "statement_id": "archive:statement-identity",
  "record_id": "normalized-bank-record-id",
  "transaction_date": "2024-01-15",
  "iban": "EE123",
  "currency": "EUR",
  "signed_amount": -7.0,
  "simplbooks_transaction_id": "transaction-501",
  "evidence_kind": "simplbooks_discovery",
  "captured_at": "2026-08-22T10:00:00Z",
  "source_identity": {"path": "companies/example/artifacts/normalized/2024-01.json", "sha256": "aaaaaaaaaaaaaaaaaaaaaaaaaaaaaaaaaaaaaaaaaaaaaaaaaaaaaaaaaaaaaaaa", "record_ref": "normalized-bank-record-id"},
  "evidence_source": {"path": "companies/example/artifacts/discovery/snapshots/2024-20260822T100000Z-overview.json", "sha256": "bbbbbbbbbbbbbbbbbbbbbbbbbbbbbbbbbbbbbbbbbbbbbbbbbbbbbbbbbbbbbbbb", "record_ref": "transaction-501"}
}
